about,projname,projurl,star,topics,update,username,userurl
"ANTLR (ANother Tool for Language Recognition) is a powerful parser generator for reading, processing, executing, or translating structured text or binary files.",antlr4,github.com/antlr/antlr4,13156,"javascript,python,java,dart,swift,golang,php,parse,csharp,parsing,cpp,parser-generator,grammar,antlr,antlr4,language-recognition","Oct 17, 2022",antlr,github.com/antlr
Python logging made (stupidly) simple,loguru,github.com/Delgan/loguru,13131,"python,log,logger,logging","Oct 10, 2022",Delgan,github.com/Delgan
Python composable command line interface toolkit,click,github.com/pallets/click,13077,"python,cli,click,pallets","Oct 13, 2022",pallets,github.com/pallets
Sourcetrail - free and open-source interactive source explorer,Sourcetrail,github.com/CoatiSoftware/Sourcetrail,12955,"python,c,java,cpp","Dec 13, 2021",CoatiSoftware,github.com/CoatiSoftware
Home Page:,pyscript,github.com/pyscript/pyscript,14698,"javascript,python,html","Oct 16, 2022",pyscript,github.com/pyscript
python模拟登陆一些大型网站，还有一些简单的爬虫，希望对你们有所帮助,awesome-python-login-model,github.com/Kr1s77/awesome-python-login-model,14609,"python,twitter-bot,selenium,facebook-login,spiders,weixinbot,jingdong,sina-spider,github-login,zhihu-spider,tuchong,taobao-spider,bilibili-login,lagou-spider,163mail-login,douban-spider,guoke-spider","Jul 26, 2022",Kr1s77,github.com/Kr1s77
"Kodi is an award-winning free and open source home theater/media center software and entertainment hub for digital media. With its beautiful interface and powerful skinning engine, it's available for Android, BSD, Linux, macOS, iOS, tvOS and Windows.",xbmc,github.com/xbmc/xbmc,14592,"android,python,macos,linux,c-plus-plus,ios,multimedia,xml,kodi,windows-uwp,media-player,windows-desktop,xbmc,media-center,hacktoberfest,home-theater,entertainment-hub","Oct 17, 2022",xbmc,github.com/xbmc
经典编程书籍大全，涵盖：计算机系统与网络、系统架构、算法与数据结构、前端开发、后端开发、移动开发、数据库、测试、项目与团队、程序员职业修炼、求职面试等,awesome-cs-books,github.com/imarvinle/awesome-cs-books,14463,"python,java,linux,javaweb,cs-books","Jun 15, 2022",imarvinle,github.com/imarvinle
We have made you a wrapper you can't refuse,python-telegram-bot,github.com/python-telegram-bot/python-telegram-bot,19917,"python,bot,framework,telegram,chatbot,hacktoberfest","Oct 16, 2022",python-telegram-bot,github.com/python-telegram-bot
"Free, open source crypto trading bot",freqtrade,github.com/freqtrade/freqtrade,19571,"python,bitcoin,telegram-bot,trading-bot,cryptocurrency,cryptocurrencies,trade,algorithmic-trading,freqtrade","Oct 17, 2022",freqtrade,github.com/freqtrade
Facebook AI Research Sequence-to-Sequence Toolkit written in Python.,fairseq,github.com/facebookresearch/fairseq,19432,"python,pytorch,artificial-intelligence","Oct 17, 2022",facebookresearch,github.com/facebookresearch
基于Python的开源量化交易平台开发框架,vnpy,github.com/vnpy/vnpy,19348,"python,finance,trading,fintech,algotrading,quant,investment,vnpy","Oct 1, 2022",vnpy,github.com/vnpy
JumpServer 是广受欢迎的开源堡垒机，是符合 4A 规范的专业运维安全审计系统。,jumpserver,github.com/jumpserver/jumpserver,19292,"python,django,terminal,ssh-server,coco,luna,bastion-host,jumpserver,web-terminal","Oct 17, 2022",jumpserver,github.com/jumpserver
Clone a voice in 5 seconds to generate arbitrary speech in real-time,Real-Time-Voice-Cloning,github.com/CorentinJ/Real-Time-Voice-Cloning,37120,"python,deep-learning,tensorflow,pytorch,tts,voice-cloning","Sep 9, 2022",CorentinJ,github.com/CorentinJ
Hunt down social media accounts by username across social networks,sherlock,github.com/sherlock-project/sherlock,36451,"python,windows,macos,linux,cli,osint,tools,sherlock,python3,hacktoberfest,information-gathering,reconnaissance,redteam,hacktoberfest2022","Oct 16, 2022",sherlock-project,github.com/sherlock-project
Python Data Science Handbook: full text in Jupyter Notebooks,PythonDataScienceHandbook,github.com/jakevdp/PythonDataScienceHandbook,36240,"python,numpy,scikit-learn,jupyter-notebook,pandas,matplotlib","Oct 4, 2022",jakevdp,github.com/jakevdp
《动手学深度学习》：面向中文读者、能运行、可讨论。中英文版被60个国家的400所大学用于教学。,d2l-zh,github.com/d2l-ai/d2l-zh,35670,"python,machine-learning,natural-language-processing,computer-vision,deep-learning,book,notebook,chinese","Oct 16, 2022",d2l-ai,github.com/d2l-ai
Minimal examples of data structures and algorithms in Python,algorithms,github.com/keon/algorithms,21710,"python,search,tree,algorithm,data-structure,algorithms,graph,competitive-programming,sort","Oct 4, 2022",keon,github.com/keon
The fundamental package for scientific computing with Python.,numpy,github.com/numpy/numpy,21706,"python,numpy","Oct 17, 2022",numpy,github.com/numpy
"Consolidating and extending hosts files from several well-curated sources. Optionally pick extensions for porn, social media, and other categories.",hosts,github.com/StevenBlack/hosts,21670,"python,security,privacy,protection,anti-virus,malware,ad-blocker,unified-hosts,porn-filter,social-media-filter,hosts,gambling-filter,ransomware,pornblocker,trojans,curated-sources","Oct 16, 2022",StevenBlack,github.com/StevenBlack
"Glances an Eye on your system. A top/htop alternative for GNU/Linux, BSD, Mac OS and Windows operating systems.",glances,github.com/nicolargo/glances,21581,"python,multi-platform,terminal,web,monitoring,system,restful,restful-api","Oct 16, 2022",nicolargo,github.com/nicolargo
Streamlit — The fastest way to build data apps in Python,streamlit,github.com/streamlit/streamlit,20988,"python,data-science,machine-learning,deep-learning,data-visualization,developer-tools,data-analysis,streamlit","Oct 17, 2022",streamlit,github.com/streamlit
Asynchronous HTTP client/server framework for asyncio and Python,aiohttp,github.com/aio-libs/aiohttp,12923,"python,http,async,http-client,aiohttp,http-server,asyncio,hacktoberfest","Oct 16, 2022",aio-libs,github.com/aio-libs
A formatter for Python files,yapf,github.com/google/yapf,12857,"python,formatter,google","Oct 3, 2022",google,github.com/google
Python Echarts Plotting Library,pyecharts,github.com/pyecharts/pyecharts,12826,"python,echarts","Oct 14, 2022",pyecharts,github.com/pyecharts
Software to automate the management and configuration of any infrastructure or application at scale. Get access to the Salt software package repository here:,salt,github.com/saltstack/salt,12795,"python,iot,cloud,event-stream,zeromq,cloud-providers,event-management,configuration-management,edge,remote-execution,infrastructure-management,cloud-management,cloud-provisioning,infrastructure-as-code,infrastructure-automation,infrastructure-as-a-code,infrasructure","Oct 17, 2022",saltstack,github.com/saltstack
"深度学习入门开源书，基于TensorFlow 2.0案例实战。Open source Deep Learning book, based on TensorFlow 2.0 framework.",Deep-Learning-with-TensorFlow-book,github.com/dragen1860/Deep-Learning-with-TensorFlow-book,12773,"python,opensource,book,tensorflow,pytorch,machinelearning,deeplearning,tensorflow2","Aug 30, 2021",dragen1860,github.com/dragen1860
"Open source self-hosted web archiving. Takes URLs/browser history/bookmarks/Pocket/Pinboard/etc., saves HTML, JS, PDFs, media, and more...",ArchiveBox,github.com/ArchiveBox/ArchiveBox,14335,"python,rss,backups,firefox,pinboard,youtube-dl,chromium,self-hosted,wget,pocket,browser-bookmarks,warc,web-archiving,wayback-machine,digipres,singlefile,headless-browser,bookmark-archiver,internet-archiving,archivebox","Sep 14, 2022",ArchiveBox,github.com/ArchiveBox
"A fast, distributed, high performance gradient boosting (GBT, GBDT, GBRT, GBM or MART) framework based on decision tree algorithms, used for ranking, classification and many other machine learning tasks.",LightGBM,github.com/microsoft/LightGBM,14276,"microsoft,python,machine-learning,data-mining,r,parallel,distributed,kaggle,gbdt,gbm,lightgbm,gbrt,decision-trees,gradient-boosting","Oct 17, 2022",microsoft,github.com/microsoft
A cd command that learns - easily navigate directories from the command line,autojump,github.com/wting/autojump,14260,"python,filesystem,command-line-tool,autojump","Oct 15, 2022",wting,github.com/wting
100-Days-Of-ML-Code中文版,100-Days-Of-ML-Code,github.com/MLEveryday/100-Days-Of-ML-Code,19218,"python,machine-learning,tutorial,deep-learning,tensorflow,keras,jupyter-notebook,supervised-learning,unsupervised-learning,chinese-simplified,infographics,100-days-of-ml-code","Apr 6, 2022",MLEveryday,github.com/MLEveryday
"Python programs, usually short, of considerable difficulty, to perfect particular skills.",pytudes,github.com/norvig/pytudes,19216,"python,practice,programming,python-3,demonstrate-skills","Sep 30, 2022",norvig,github.com/norvig
PArallel Distributed Deep LEarning: Machine Learning Framework from Industrial Practice （『飞桨』核心框架，深度学习&机器学习高性能单机、分布式训练和跨平台部署）,Paddle,github.com/PaddlePaddle/Paddle,19017,"python,machine-learning,deep-learning,neural-network,scalability,efficiency,paddlepaddle,distributed-training","Oct 17, 2022",PaddlePaddle,github.com/PaddlePaddle
FlatBuffers: Memory Efficient Serialization Library,flatbuffers,github.com/google/flatbuffers,18888,"javascript,python,c,java,go,c-sharp,rust,c-plus-plus,serialization,typescript,protobuf,cross-platform,flatbuffers,zero-copy,marshalling,grpc,rpc,json-parser,mmap,serialization-library","Oct 14, 2022",google,github.com/google
"Flexible and powerful data analysis / manipulation library for Python, providing labeled data structures similar to R data.frame objects, statistical functions, and much more",pandas,github.com/pandas-dev/pandas,35585,"python,data-science,flexible,pandas,alignment,data-analysis","Oct 17, 2022",pandas-dev,github.com/pandas-dev
A collection of design patterns/idioms in Python,python-patterns,github.com/faif/python-patterns,35254,"python,idioms,design-patterns","Aug 21, 2022",faif,github.com/faif
Apache Spark - A unified analytics engine for large-scale data processing,spark,github.com/apache/spark,34119,"python,java,r,scala,sql,big-data,spark,jdbc","Oct 17, 2022",apache,github.com/apache
AiLearning：数据分析+机器学习实战+线性代数+PyTorch+NLTK+TF2,ailearning,github.com/apachecn/ailearning,34083,"python,nlp,svm,scikit-learn,sklearn,regression,logistic,dnn,lstm,pca,rnn,deeplearning,kmeans,adaboost,apriori,fp-growth,svd,naivebayes,mahchine-leaning,recommendedsystem","Jul 7, 2022",apachecn,github.com/apachecn
A youtube-dl fork with additional features and fixes,yt-dlp,github.com/yt-dlp/yt-dlp,33681,"python,youtube-dl,video-downloader,youtube-downloader,hacktoberfest,sponsorblock,youtube-dlc,sponskrub,yt-dlp","Oct 17, 2022",yt-dlp,github.com/yt-dlp
"Tornado is a Python web framework and asynchronous networking library, originally developed at FriendFeed.",tornado,github.com/tornadoweb/tornado,20800,"python,asynchronous","Oct 15, 2022",tornadoweb,github.com/tornadoweb
Deezer source separation library including pretrained models.,spleeter,github.com/deezer/spleeter,20648,"python,deep-learning,tensorflow,model,drums,deezer,pretrained-models,bass,audio-processing,vocals","Sep 30, 2022",deezer,github.com/deezer
"Build and train PyTorch models and connect them to the ML lifecycle using Lightning App templates, without handling DIY infrastructure, cost management, scaling, and other headaches.",lightning,github.com/Lightning-AI/lightning,20321,"python,data-science,machine-learning,ai,deep-learning,pytorch,artificial-intelligence","Oct 17, 2022",Lightning-AI,github.com/Lightning-AI
Python examples of popular machine learning algorithms with interactive Jupyter demos and math being explained,homemade-machine-learning,github.com/trekhleb/homemade-machine-learning,20301,"python,machine-learning,algorithm,jupyter,machine-learning-algorithms,jupyter-notebook,machinelearning","Oct 4, 2022",trekhleb,github.com/trekhleb
Distributed Task Queue (development branch),celery,github.com/celery/celery,20278,"python,redis,amqp,python-library,sqs,python3,task-runner,sqs-queue,task-manager,task-scheduler,redis-queue,queued-jobs,queue-workers,queue-tasks","Oct 17, 2022",celery,github.com/celery
Pythonic HTML Parsing for Humans™,requests-html,github.com/psf/requests-html,12768,"python,html,http,scraping,requests,kennethreitz,beautifulsoup,lxml,css-selectors,pyquery","Jul 30, 2022",psf,github.com/psf
"Suite of tools for deploying and training deep learning models using the JVM. Highlights include model import for keras, tensorflow, and onnx/pytorch, a modular and tiny c++ library for running math code and a java based math library on top of the core c++ library. Also includes samediff: a pytorch/tensorflow like library for running deep learning using automatic differentiation.",deeplearning4j,github.com/deeplearning4j/deeplearning4j,12648,"python,java,clojure,scala,spark,hadoop,gpu,intellij,linear-algebra,artificial-intelligence,deeplearning,neural-nets,dl4j,matrix-library,deeplearning4j","Oct 17, 2022",deeplearning4j,github.com/deeplearning4j
"Mobile Security Framework (MobSF) is an automated, all-in-one mobile application (Android/iOS/Windows) pen-testing, malware analysis and security assessment framework capable of performing static and dynamic analysis.",Mobile-Security-Framework-MobSF,github.com/MobSF/Mobile-Security-Framework-MobSF,12632,"python,rest,static-analysis,apk,owasp,dynamic-analysis,web-security,malware-analysis,mobsf,android-security,mobile-security,windows-mobile-security,ios-security,mobile-security-framework,api-testing,cwe,devsecops,runtime-security,mstg,masvs","Oct 16, 2022",MobSF,github.com/MobSF
Best Practices on Recommendation Systems,recommenders,github.com/microsoft/recommenders,14225,"microsoft,python,kubernetes,data-science,machine-learning,tutorial,deep-learning,azure,rating,jupyter-notebook,artificial-intelligence,ranking,recommender,recommendation-system,recommendation-engine,recommendation,recommendation-algorithm,operationalization","Oct 16, 2022",microsoft,github.com/microsoft
"Free software that works great, and also happens to be open-source Python.",awesome-python-applications,github.com/mahmoud/awesome-python-applications,14008,"audio,game,python,productivity,science,education,application,gui,video,graphics","Jul 10, 2022",mahmoud,github.com/mahmoud
Optional static typing for Python,mypy,github.com/python/mypy,13948,"python,typechecker,types,linter,typing","Oct 17, 2022",python,github.com/python
"Pulumi - Universal Infrastructure as Code. Your Cloud, Your Language, Your Way",pulumi,github.com/pulumi/pulumi,13935,"javascript,python,go,kubernetes,golang,aws,cloud,typescript,csharp,serverless,fsharp,dotnet,azure,containers,gcp,iac,cloud-computing,infrastructure-as-code","Oct 17, 2022",pulumi,github.com/pulumi
编程电子书，电子书，编程书籍，包括C，C#，Docker，Elasticsearch，Git，Hadoop，HeadFirst，Java，Javascript，jvm，Kafka，Linux，Maven，MongoDB，MyBatis，MySQL，Netty，Nginx，Python，RabbitMQ，Redis，Scala，Solr，Spark，Spring，SpringBoot，SpringCloud，TCPIP，Tomcat，Zookeeper，人工智能，大数据类，并发编程，数据库类，数据挖掘，新面试题，架构设计，算法系列，计算机类，设计模式，软件测试，重构优化，等更多分类,pdf,github.com/itdevbooks/pdf,18207,"mysql,python,linux,docker,redis,elasticsearch,spark,spring,hadoop,rabbitmq,solr,jvm,netty,springboot,mybatis,springcloud","May 18, 2022",itdevbooks,github.com/itdevbooks
"A cross-platform command-line utility that creates projects from cookiecutters (project templates), e.g. Python package projects, C projects.",cookiecutter,github.com/cookiecutter/cookiecutter,18195,"python,cookiecutter","Oct 14, 2022",cookiecutter,github.com/cookiecutter
爬虫集合,awesome-spider,github.com/facert/awesome-spider,18093,"python,awesome,spider","May 19, 2022",facert,github.com/facert
ZeroNet - Decentralized websites using Bitcoin crypto and BitTorrent network,ZeroNet,github.com/HelloZeroNet/ZeroNet,17654,"python,torrent,web,bittorrent,bitcoin,decentralized,realtime,p2p,tor,anticensorship,internet-freedom,anonymity","Oct 8, 2022",HelloZeroNet,github.com/HelloZeroNet
GraalVM: Run Programs Faster Anywhere,graal,github.com/oracle/graal,17628,"javascript,ruby,python,c,java,vm,r,polyglot","Oct 15, 2022",oracle,github.com/oracle
Awesome list of open source applications for macOS.,open-source-mac-os-apps,github.com/serhii-londar/open-source-mac-os-apps,32575,"javascript,ruby,python,c,macos,swift,open-source,mac,c-plus-plus,awesome,opensource,objective-c,apps,applications,macosx,awesome-list,hacktoberfest,macos-application","Oct 14, 2022",serhii-londar,github.com/serhii-londar
Apache Flink,flink,github.com/apache/flink,19948,"python,java,scala,sql,big-data,flink","Oct 17, 2022",apache,github.com/apache
"An advanced Twitter scraping & OSINT tool written in Python that doesn't use Twitter's API, allowing you to scrape a user's followers, following, Tweets and more while evading most API limitations.",twint,github.com/twintproject/twint,13905,"python,elasticsearch,kibana,osint,twitter,tweets,scrape,twint,tweep,scrape-followers,scrape-likes,scrape-following","May 19, 2022",twintproject,github.com/twintproject
Textual is a TUI (Text User Interface) framework for Python inspired by modern web development.,textual,github.com/Textualize/textual,13900,"python,terminal,tui,rich","Oct 16, 2022",Textualize,github.com/Textualize
微信《跳一跳》Python 辅助,wechat_jump_game,github.com/wangshub/wechat_jump_game,13870,"python,adb,wechat-app","Jun 21, 2022",wangshub,github.com/wangshub
"Analytical Web Apps for Python, R, Julia, and Jupyter. No JavaScript Required.",dash,github.com/plotly/dash,17482,"react,python,productivity,flask,finance,data-science,bioinformatics,r,jupyter,julia,web-app,modeling,plotly,data-visualization,dash,rstats,gui-framework,charting,technical-computing,plotly-dash","Oct 15, 2022",plotly,github.com/plotly
"Investment Research for Everyone, Anywhere.",OpenBBTerminal,github.com/OpenBB-finance/OpenBBTerminal,17307,"python,finance,machine-learning,crypto,artificial-intelligence,cryptocurrency,economics,stocks,quantitative-finance,investment,hacktoberfest,investment-research","Oct 17, 2022",OpenBB-finance,github.com/OpenBB-finance
"Microsoft Cognitive Toolkit (CNTK), an open source deep-learning toolkit",CNTK,github.com/microsoft/CNTK,17240,"python,java,c-sharp,c-plus-plus,machine-learning,deep-neural-networks,deep-learning,neural-network,cntk,distributed,cognitive-toolkit","Sep 30, 2022",microsoft,github.com/microsoft
"A modular, high performance, headless e-commerce platform built with Python, GraphQL, Django, and React.",saleor,github.com/saleor/saleor,17037,"python,graphql,ecommerce,django,shopping-cart,commerce,shop,headless,store,ecommerce-platform,e-commerce,cart,multichannel,hacktoberfest,graphql-api,headless-ecommerce,headless-commerce","Oct 17, 2022",saleor,github.com/saleor
"坚持分享 GitHub 上高质量、有趣实用的开源技术教程、开发者工具、编程网站、技术资讯。A list cool, interesting projects of GitHub.",GitHubDaily,github.com/GitHubDaily/GitHubDaily,16913,"github,javascript,python,java,linux,kubernetes,markdown,open-source,development,web,ai,frontend,backend,tutorials,developer-tools,algorithms-and-data-structures","Jun 11, 2022",GitHubDaily,github.com/GitHubDaily
"ChatterBot is a machine learning, conversational dialog engine for creating chat bots",ChatterBot,github.com/gunthercox/ChatterBot,12578,"python,bot,language,machine-learning,chatbot,chatterbot,conversation","Sep 5, 2022",gunthercox,github.com/gunthercox
Python 练习册，每天一个小程序,show-me-the-code,github.com/Yixiaohan/show-me-the-code,12504,"python,tutorial,python-web","Nov 11, 2019",Yixiaohan,github.com/Yixiaohan
Command line interface for testing internet bandwidth using speedtest.net,speedtest-cli,github.com/sivel/speedtest-cli,12278,"python,python-library,python-script,speedtest","Oct 10, 2022",sivel,github.com/sivel
The interactive graphing library for Python (includes Plotly Express),plotly.py,github.com/plotly/plotly.py,12268,"visualization,d3,python,webgl,dashboard,interactive,sparkles,plotly,declarative,jupyter-notebook,regl,plotlyjs,graph-library,plotly-dash","Oct 14, 2022",plotly,github.com/plotly
Awesome list of open-source startup alternatives to well-known SaaS products,awesome-oss-alternatives,github.com/RunaCapital/awesome-oss-alternatives,12263,"python,open-source,list,awesome,unicorns,resources,saas,awesome-list,startups,alternatives","Oct 14, 2022",RunaCapital,github.com/RunaCapital
"News, full-text, and article metadata extraction in Python 3. Advanced docs:",newspaper,github.com/codelucas/newspaper,12205,"python,crawler,scraper,news,crawling,news-aggregator","Oct 4, 2022",codelucas,github.com/codelucas
"An open source AutoML toolkit for automate machine learning lifecycle, including feature engineering, neural architecture search, model compression and hyper-parameter tuning.",nni,github.com/microsoft/nni,12087,"python,data-science,machine-learning,deep-learning,neural-network,tensorflow,machine-learning-algorithms,pytorch,distributed,hyperparameter-optimization,feature-engineering,nas,bayesian-optimization,hyperparameter-tuning,automl,automated-machine-learning,model-compression,neural-architecture-search,deep-neural-network,mlops","Oct 17, 2022",microsoft,github.com/microsoft
Free and Open Source Enterprise Resource Planning (ERP),erpnext,github.com/frappe/erpnext,12058,"support,python,distribution,integrations,localization,erp,profit,accounting,crm,healthcare,project-management,manufacturing,frappe,erpnext,procurement,retail,hacktoberfest,point-of-sale,hrms,asset-management","Oct 17, 2022",frappe,github.com/frappe
Privacy-respecting metasearch engine,searx,github.com/searx/searx,12032,"python,search,search-engine,metasearch,metasearch-engine","Oct 14, 2022",searx,github.com/searx
Serverless Python,Zappa,github.com/Miserlou/Zappa,11879,"python,flask,lambda,django,aws-lambda,serverless,api-gateway,serverless-framework,pyramid,zappa,bottle","Jul 20, 2022",Miserlou,github.com/Miserlou
TuShare is a utility for crawling historical data of China stocks,tushare,github.com/waditu/tushare,11787,"python,finance,pandas,fintech,stock-market,stock-data,tushare,realtime-quotes-data","Mar 28, 2022",waditu,github.com/waditu
A ranked list of awesome machine learning Python libraries. Updated weekly.,best-of-ml-python,github.com/ml-tooling/best-of-ml-python,11762,"python,nlp,data-science,machine-learning,awesome,deep-learning,tensorflow,scikit-learn,python-library,keras,ml,data-visualization,pytorch,transformer,data-analysis,automl,jax,data-visualizations,best-of","Oct 14, 2022",ml-tooling,github.com/ml-tooling
"The ""Python Machine Learning (1st edition)""  book code repository and info resource",python-machine-learning-book,github.com/rasbt/python-machine-learning-book,11702,"python,data-science,machine-learning,data-mining,neural-network,scikit-learn,machine-learning-algorithms,logistic-regression","Aug 29, 2022",rasbt,github.com/rasbt
Seamless operability between C++11 and Python,pybind11,github.com/pybind/pybind11,11699,"python,bindings","Oct 17, 2022",pybind,github.com/pybind
Network Analysis in Python,networkx,github.com/networkx/networkx,11680,"python,graph-algorithms,graph-theory,complex-networks,graph-visualization,graph-generation,graph-analysis","Oct 17, 2022",networkx,github.com/networkx
A collection of simple python mini projects to enhance your python skills,python-mini-projects,github.com/Python-World/python-mini-projects,11672,"python,opensource,tools,projects,learn-to-code,stuff,automate,miniprojects","Jul 17, 2022",Python-World,github.com/Python-World
A community-maintained Python framework for creating mathematical animations.,manim,github.com/ManimCommunity/manim,11616,"python,math,animations,hacktoberfest,manim","Oct 16, 2022",ManimCommunity,github.com/ManimCommunity
An API wrapper for Discord written in Python.,discord.py,github.com/Rapptz/discord.py,11616,"python,bot,discord,discord-bot,discord-api,discord-py,python-3","Oct 14, 2022",Rapptz,github.com/Rapptz
walle - 瓦力 Devops开源项目代码部署平台,walle-web,github.com/meolu/walle-web,11533,"python,git,devops,deployer,cd,devops-tools,walle-web","Jan 6, 2022",meolu,github.com/meolu
"一些非常有趣的python爬虫例子,对新手比较友好,主要爬取淘宝、天猫、微信、微信读书、豆瓣、QQ等网站。(Some interesting examples of python crawlers that are friendly to beginners. )",examples-of-web-crawlers,github.com/shengqiangzhang/examples-of-web-crawlers,11478,"python,crawler,spider,example,selenium,multithreading,stock,wechat,taobao,pyquery,tmall,fund,agent-pool,wechat-report,wereader","Apr 27, 2022",shengqiangzhang,github.com/shengqiangzhang
AWX Project,awx,github.com/ansible/awx,11463,"python,ansible,automation,django,reactjs,django-rest-framework,hacktoberfest,awx","Oct 15, 2022",ansible,github.com/ansible
A toolkit for making real world machine learning and data analysis applications in C++,dlib,github.com/davisking/dlib,11463,"python,c-plus-plus,machine-learning,computer-vision,deep-learning,machine-learning-library,dlib","Oct 9, 2022",davisking,github.com/davisking
Data parsing and validation using Python type hints,pydantic,github.com/pydantic/pydantic,11289,"python,validation,parsing,json-schema,hints,python37,python38,pydantic,python39,python310","Oct 16, 2022",pydantic,github.com/pydantic
