about,projname,projurl,star,topics,update,username,userurl
Learn how to design large-scale systems. Prep for the system design interview.  Includes Anki flashcards.,system-design-primer,github.com/donnemartin/system-design-primer,200080,"python,design,development,programming,web,system,design-patterns,interview,web-application,webapp,interview-practice,interview-questions,design-system","Oct 15, 2022",donnemartin,github.com/donnemartin
An Open Source Machine Learning Framework for Everyone,tensorflow,github.com/tensorflow/tensorflow,168421,"python,machine-learning,deep-neural-networks,deep-learning,neural-network,tensorflow,ml,distributed","Oct 17, 2022",tensorflow,github.com/tensorflow
技术面试必备基础知识、Leetcode、计算机操作系统、计算机网络、系统设计,CS-Notes,github.com/CyC2018/CS-Notes,157617,"python,java,computer-science,algorithm,leetcode,cpp,interview,system-design","Oct 7, 2022",CyC2018,github.com/CyC2018
All Algorithms implemented in Python,Python,github.com/TheAlgorithms/Python,146978,"python,education,algorithm,practice,interview,sorting-algorithms,learn,algos,algorithm-competitions,sorts,hacktoberfest,algorithms-implemented,community-driven,searches","Oct 17, 2022",TheAlgorithms,github.com/TheAlgorithms
"A curated list of awesome Python frameworks, libraries, software and resources",awesome-python,github.com/vinta/awesome-python,144617,"python,awesome,python-library,collections,python-framework,python-resources","Oct 13, 2022",vinta,github.com/vinta
免费的计算机编程类中文书籍，欢迎投稿,free-programming-books-zh_CN,github.com/justjavac/free-programming-books-zh_CN,96139,"react,javascript,android,kotlin,python,swift,pdf,ios,angular,react-native,programming,books,vue,free","Aug 13, 2022",justjavac,github.com/justjavac
Curated list of project-based tutorials,project-based-learning,github.com/practical-tutorials/project-based-learning,79264,"javascript,python,golang,tutorial,cpp,beginner-project,project,webdevelopment","Oct 6, 2022",practical-tutorials,github.com/practical-tutorials
Magnificent app which corrects your previous console command.,thefuck,github.com/nvbn/thefuck,74092,"python,shell","Sep 30, 2022",nvbn,github.com/nvbn
"Transformers: State-of-the-art Machine Learning for Pytorch, TensorFlow, and JAX.",transformers,github.com/huggingface/transformers,72346,"python,nlp,machine-learning,natural-language-processing,deep-learning,tensorflow,pytorch,transformer,speech-recognition,seq2seq,flax,pretrained-models,language-models,nlp-library,language-model,hacktoberfest,bert,jax,pytorch-transformers,model-hub","Oct 17, 2022",huggingface,github.com/huggingface
The Web framework for perfectionists with deadlines.,django,github.com/django/django,66828,"python,django,views,framework,orm,web,apps,templates,models","Oct 17, 2022",django,github.com/django
The Python micro framework for building web applications.,flask,github.com/pallets/flask,60837,"python,flask,web-framework,wsgi,jinja,werkzeug,pallets","Oct 15, 2022",pallets,github.com/pallets
"分享 GitHub 上有趣、入门级的开源项目。Share interesting, entry-level open source projects on GitHub.",HelloGitHub,github.com/521xueweihan/HelloGitHub,60245,"github,python,awesome,hellogithub","Oct 9, 2022",521xueweihan,github.com/521xueweihan
Tensors and Dynamic neural networks in Python with strong GPU acceleration,pytorch,github.com/pytorch/pytorch,59625,"python,machine-learning,deep-learning,neural-network,gpu,numpy,autograd,tensor","Oct 17, 2022",pytorch,github.com/pytorch
Deep Learning for humans,keras,github.com/keras-team/keras,56412,"python,data-science,machine-learning,deep-learning,tensorflow,neural-networks","Oct 15, 2022",keras-team,github.com/keras-team
Open source home automation that puts local control and privacy first.,core,github.com/home-assistant/core,55328,"python,home-automation,mqtt,raspberry-pi,iot,internet-of-things,asyncio,hacktoberfest","Oct 17, 2022",home-assistant,github.com/home-assistant
"Ansible is a radically simple IT automation platform that makes your applications and systems easier to deploy and maintain. Automate everything from code deployment to network configuration to cloud management, in a language that approaches plain English, using SSH, with no agents to install on remote systems.",ansible,github.com/ansible/ansible,55065,"python,ansible,hacktoberfest","Oct 16, 2022",ansible,github.com/ansible
scikit-learn: machine learning in Python,scikit-learn,github.com/scikit-learn/scikit-learn,51720,"python,data-science,machine-learning,statistics,data-analysis","Oct 17, 2022",scikit-learn,github.com/scikit-learn
"FastAPI framework, high performance, easy to learn, fast to code, ready for production",fastapi,github.com/tiangolo/fastapi,50572,"python,api,json,framework,web,rest,json-schema,async,swagger,openapi,python3,asyncio,swagger-ui,redoc,openapi3,python-types,uvicorn,starlette,pydantic,fastapi","Oct 16, 2022",tiangolo,github.com/tiangolo
推荐刷题网站：,leetcode,github.com/azl397985856/leetcode,49594,"javascript,python,java,computer-science,tree,algorithm,algorithms,leetcode,cpp,interview,algo,data-structures,leetcode-solutions,algorithms-datastructures","Oct 17, 2022",azl397985856,github.com/azl397985856
Apache Superset is a Data Visualization and Data Exploration Platform,superset,github.com/apache/superset,48595,"react,python,flask,data-science,bi,analytics,superset,apache,data-visualization,data-engineering,business-intelligence,data-viz,data-analytics,data-analysis,sql-editor,asf,business-analytics,apache-superset","Oct 17, 2022",apache,github.com/apache
《代码随想录》LeetCode 刷题攻略：200道经典题目刷题顺序，共60w字的详细图解，视频难点剖析，50余张思维导图，支持C++，Java，Python，Go，JavaScript等多语言版本，从此算法学习不再迷茫！,leetcode-master,github.com/youngyangyang04/leetcode-master,32453,"javascript,python,java,go,algorithm,leetcode,cpp,interview,programmer,offer","Oct 17, 2022",youngyangyang04,github.com/youngyangyang04
"Sentry is cross-platform application monitoring, with a focus on error reporting.",sentry,github.com/getsentry/sentry,32286,"python,devops,django,monitor,monitoring,crash-reporting,error-monitoring,sentry,crash-reports,csp-report,apm,hacktoberfest,error-logging","Oct 17, 2022",getsentry,github.com/getsentry
What the f*ck Python?,wtfpython,github.com/satwikkansal/wtfpython,31799,"python,snippets,documentation,wtf,gotchas,interview-questions,python-interview-questions,pitfalls,wats","Sep 18, 2022",satwikkansal,github.com/satwikkansal
"Linux, Jenkins, AWS, SRE, Prometheus, Docker, Python, Ansible, Git, Kubernetes, Terraform, OpenStack, SQL, NoSQL, Azure, GCP, DNS, Elastic, Network, Virtualization. DevOps Interview Questions",devops-exercises,github.com/bregman-arie/devops-exercises,31344,"python,git,linux,docker,kubernetes,aws,ansible,devops,sql,azure,containers,terraform,openstack,interview,prometheus,coding,sre,interview-questions,production-engineer","Oct 17, 2022",bregman-arie,github.com/bregman-arie
Learn how to responsibly deliver value with machine learning.,Made-With-ML,github.com/GokuMohandas/Made-With-ML,31155,"python,data-science,machine-learning,natural-language-processing,deep-learning,pytorch,data-engineering,mlops","Oct 5, 2022",GokuMohandas,github.com/GokuMohandas
"Interactive Data Visualization in the browser, from  Python",bokeh,github.com/bokeh/bokeh,16789,"visualization,javascript,python,plots,jupyter,visualisation,data-visualisation,bokeh,plotting,notebooks,interactive-plots,numfocus","Oct 16, 2022",bokeh,github.com/bokeh
Comprehensive Python Cheatsheet,python-cheatsheet,github.com/gto76/python-cheatsheet,30328,"python,reference,cheatsheet,python-cheatsheet","Oct 12, 2022",gto76,github.com/gto76
The uncompromising Python code formatter,black,github.com/psf/black,29812,"python,formatter,code,yapf,gofmt,autopep8,hacktoberfest,codeformatter,pre-commit-hook","Oct 17, 2022",psf,github.com/psf
Certbot is EFF's tool to obtain certs from Let's Encrypt and (optionally) auto-enable HTTPS on your server.  It can also act as a client for any other CA that uses the ACME protocol.,certbot,github.com/certbot/certbot,29347,"python,letsencrypt,acme-client,certificate,acme,certbot","Oct 15, 2022",certbot,github.com/certbot
Simple Python version management,pyenv,github.com/pyenv/pyenv,29067,"python,shell","Oct 17, 2022",pyenv,github.com/pyenv
An interactive TLS-capable intercepting HTTP proxy for penetration testers and software developers.,mitmproxy,github.com/mitmproxy/mitmproxy,28966,"python,tls,debugging,ssl,http,security,proxy,websocket,http2,man-in-the-middle,hacktoberfest","Oct 16, 2022",mitmproxy,github.com/mitmproxy
Zulip server and web app—powerful open source team chat,zulip,github.com/zulip/zulip,16550,"electron,javascript,python,slack,chat,react-native,foss,apache,collaboration,python3,free,zulip","Oct 17, 2022",zulip,github.com/zulip
Next generation Python web server/framework | Build fast. Run fast.,sanic,github.com/sanic-org/sanic,16521,"python,framework,web-server,web,sanic,web-framework,api-server,asyncio,asgi","Oct 16, 2022",sanic-org,github.com/sanic-org
Python sample codes for robotics algorithms.,PythonRobotics,github.com/AtsushiSakai/PythonRobotics,16508,"python,algorithm,control,robot,localization,robotics,mapping,animation,path-planning,slam,autonomous-driving,autonomous-vehicles,ekf,hacktoberfest,cvxpy,autonomous-navigation","Oct 13, 2022",AtsushiSakai,github.com/AtsushiSakai
"Apache Airflow - A platform to programmatically author, schedule, and monitor workflows",airflow,github.com/apache/airflow,27857,"python,workflow,airflow,scheduler,apache,hacktoberfest,apache-airflow","Oct 17, 2022",apache,github.com/apache
Odoo. Open Source Apps To Grow Your Business.,odoo,github.com/odoo/odoo,26592,"python,business,erp,apps,management,odoo,odoo-apps","Oct 17, 2022",odoo,github.com/odoo
120+ interactive Python coding interview challenges (algorithms and data structures).  Includes Anki flashcards.,interactive-coding-challenges,github.com/donnemartin/interactive-coding-challenges,26347,"python,development,algorithm,programming,data-structure,interview,competitive-programming,coding,interview-practice,interview-questions","Oct 2, 2022",donnemartin,github.com/donnemartin
"Python best practices guidebook, written for humans.",python-guide,github.com/realpython/python-guide,25455,"python,book,guide,kennethreitz","Sep 1, 2022",realpython,github.com/realpython
Python资源大全中文版，包括：Web框架、网络爬虫、模板引擎、数据库、数据可视化、图片处理等，由「开源前哨」和「Python开发者」微信公号团队维护更新。,awesome-python-cn,github.com/jobbole/awesome-python-cn,25070,python,"Aug 29, 2022",jobbole,github.com/jobbole
"Cross-platform, fast, feature-rich, GPU based terminal",kitty,github.com/kovidgoyal/kitty,16307,"python,c,terminal,opengl,terminfo,terminal-emulators,vt100","Oct 17, 2022",kovidgoyal,github.com/kovidgoyal
"10 Weeks, 20 Lessons, Data Science for All!",Data-Science-For-Beginners,github.com/microsoft/Data-Science-For-Beginners,16280,"python,data-science,pandas,data-visualization,data-analysis","Oct 11, 2022",microsoft,github.com/microsoft
"The fastai book, published as Jupyter Notebooks",fastbook,github.com/fastai/fastbook,16273,"python,data-science,machine-learning,deep-learning,book,notebooks,fastai","Sep 27, 2022",fastai,github.com/fastai
matplotlib: plotting with Python,matplotlib,github.com/matplotlib/matplotlib,16266,"python,gtk,data-science,qt,data-visualization,tk,matplotlib,plotting,hacktoberfest,wx","Oct 17, 2022",matplotlib,github.com/matplotlib
Automatic SQL injection and database takeover tool,sqlmap,github.com/sqlmapproject/sqlmap,24917,"python,database,detection,sql-injection,pentesting,exploitation,sqlmap,takeover,vulnerability-scanner","Oct 15, 2022",sqlmapproject,github.com/sqlmapproject
DEPRECATED – See,handson-ml,github.com/ageron/handson-ml,24904,"python,machine-learning,deep-learning,neural-network,tensorflow,scikit-learn,jupyter-notebook,ml,deprecated,distributed","Sep 30, 2022",ageron,github.com/ageron
A browser automation framework and ecosystem.,selenium,github.com/SeleniumHQ/selenium,24890,"javascript,ruby,python,java,webdriver,dotnet,selenium","Oct 17, 2022",SeleniumHQ,github.com/SeleniumHQ
Industrial-strength Natural Language Processing (NLP) in Python,spaCy,github.com/explosion/spaCy,24388,"python,nlp,data-science,machine-learning,natural-language-processing,ai,deep-learning,neural-network,text-classification,cython,artificial-intelligence,spacy,named-entity-recognition,neural-networks,nlp-library,tokenization,entity-linking","Oct 17, 2022",explosion,github.com/explosion
Simple and ready-to-use tutorials for TensorFlow,TensorFlow-Course,github.com/instillai/TensorFlow-Course,16222,"python,deep-learning,tensorflow,deep-learning-tutorial","Aug 13, 2021",instillai,github.com/instillai
historical code from reddit.com,reddit,github.com/reddit-archive/reddit,16195,"javascript,python,reddit","Oct 17, 2017",reddit-archive,github.com/reddit-archive
"Luigi is a Python module that helps you build complex pipelines of batch jobs. It handles dependency resolution, workflow management, visualization etc. It also comes with Hadoop support built in.",luigi,github.com/spotify/luigi,16050,"python,hadoop,scheduling,orchestration-framework,luigi","Sep 22, 2022",spotify,github.com/spotify
"Ready-to-use OCR with 80+ supported languages and all popular writing scripts including Latin, Chinese, Arabic, Devanagari, Cyrillic and etc.",EasyOCR,github.com/JaidedAI/EasyOCR,16042,"python,machine-learning,information-retrieval,data-mining,ocr,deep-learning,image-processing,cnn,pytorch,lstm,optical-character-recognition,crnn,scene-text,scene-text-recognition,easyocr","Oct 13, 2022",JaidedAI,github.com/JaidedAI
"30 days of Python programming challenge is a step-by-step guide to learn the Python programming language in 30 days. This challenge may take more than100 days, follow your own pace.",30-Days-Of-Python,github.com/Asabeneh/30-Days-Of-Python,15765,"github,python,heroku,flask,mongodb,numpy,pandas,python3,matplotlib,30-days-of-python","Oct 14, 2022",Asabeneh,github.com/Asabeneh
Web APIs for Django.,django-rest-framework,github.com/encode/django-rest-framework,24284,"python,api,django,rest","Oct 16, 2022",encode,github.com/encode
A Powerful Spider(Web Crawler) System in Python.,pyspider,github.com/binux/pyspider,15615,"python,crawler","Oct 12, 2022",binux,github.com/binux
"Official repository for IPython itself. Other repos in the IPython organization contain things like the website, documentation builds, etc.",ipython,github.com/ipython/ipython,15557,"python,data-science,jupyter,notebook,ipython,repl,hacktoberfest,closember","Oct 17, 2022",ipython,github.com/ipython
"Zipline, a Pythonic Algorithmic Trading Library",zipline,github.com/quantopian/zipline,15501,"python,quant,algorithmic-trading,zipline","Oct 7, 2022",quantopian,github.com/quantopian
Python3网络爬虫实战：淘宝、京东、网易云、B站、12306、抖音、笔趣阁、漫画小说下载、音乐电影下载等,python-spider,github.com/Jack-Cherish/python-spider,15354,"python,python3,python-spider,webspider","Jul 6, 2022",Jack-Cherish,github.com/Jack-Cherish
MicroPython - a lean and efficient Python implementation for microcontrollers and constrained systems,micropython,github.com/micropython/micropython,15257,"python,microcontroller,embedded,micropython","Oct 17, 2022",micropython,github.com/micropython
Topic Modelling for Humans,gensim,github.com/RaRe-Technologies/gensim,13611,"python,nlp,data-science,machine-learning,natural-language-processing,information-retrieval,data-mining,neural-network,word2vec,word-embeddings,topic-modeling,gensim,fasttext,document-similarity,word-similarity","Oct 17, 2022",RaRe-Technologies,github.com/RaRe-Technologies
Never use print for debugging again,PySnooper,github.com/cool-RR/PySnooper,15252,"python,debugger,logging,debug,introspection","Jul 5, 2022",cool-RR,github.com/cool-RR
"Interactive deep learning book with multi-framework code, math, and discussions. Adopted at 400 universities from 60 countries including Stanford, MIT, Harvard, and Cambridge.",d2l-en,github.com/d2l-ai/d2l-en,15188,"python,data-science,machine-learning,natural-language-processing,computer-vision,deep-learning,mxnet,book,notebook,tensorflow,keras,pytorch,kaggle","Oct 14, 2022",d2l-ai,github.com/d2l-ai
"A simple, yet elegant, HTTP library.",requests,github.com/psf/requests,48381,"python,http,client,cookies,requests,humans,forhumans,python-requests","Oct 15, 2022",psf,github.com/psf
"HTTPie for Terminal — modern, user-friendly command-line HTTP client for the API era. JSON support, colors, sessions, downloads, plugins & more.",httpie,github.com/httpie/httpie,24266,"python,api,debugging,cli,http,client,devops,json,development,terminal,web,rest,curl,rest-api,http-client,api-client,developer-tools,usability,api-testing,httpie","Oct 1, 2022",httpie,github.com/httpie
"Powerline is a statusline plugin for vim, and provides statuslines and prompts for several other applications, including zsh, bash, tmux, IPython, Awesome and Qtile.",powerline,github.com/powerline/powerline,13540,"python,vim,bash,zsh,tmux,fish,ipython,prompt,powerline,statusline","Jun 23, 2022",powerline,github.com/powerline
"A comprehensive list of pytorch related content on github,such as different models,implementations,helper libraries,tutorials etc.",Awesome-pytorch-list,github.com/bharathgs/Awesome-pytorch-list,13464,"python,nlp,data-science,machine-learning,natural-language-processing,awesome,facebook,computer-vision,deep-learning,neural-network,cv,tutorials,pytorch,awesome-list,utility-library,probabilistic-programming,papers,nlp-library,pytorch-tutorials,pytorch-model","Sep 26, 2022",bharathgs,github.com/bharathgs
The official source code repository for the calibre ebook manager,calibre,github.com/kovidgoyal/calibre,13446,"python,ebook,epub,kindle,ebook-manager,calibre,ebook-reader,ebooks,ebook-formats,epub-generation","Oct 17, 2022",kovidgoyal,github.com/kovidgoyal
"Open source UI framework written in Python, running on Windows, Linux, macOS, Android and iOS",kivy,github.com/kivy/kivy,15119,"android,python,windows,macos,linux,ios,app,ui,kivy","Oct 16, 2022",kivy,github.com/kivy
Animation engine for explanatory math videos,manim,github.com/3b1b/manim,47489,"python,animation,explanatory-math-videos,3b1b-videos","Oct 11, 2022",3b1b,github.com/3b1b
The world's simplest facial recognition api for Python and the command line,face_recognition,github.com/ageitgey/face_recognition,46098,"python,machine-learning,face-recognition,face-detection","Sep 21, 2022",ageitgey,github.com/ageitgey
"Scrapy, a fast high-level web crawling & scraping framework for Python.",scrapy,github.com/scrapy/scrapy,44874,"python,crawler,framework,scraping,crawling,hacktoberfest","Oct 15, 2022",scrapy,github.com/scrapy
A fully functional local AWS cloud stack. Develop and test your cloud & Serverless apps offline!,localstack,github.com/localstack/localstack,44066,"python,testing,aws,continuous-integration,developer-tools,hacktoberfest,localstack","Oct 17, 2022",localstack,github.com/localstack
"12 weeks, 26 lessons, 52 quizzes, classic Machine Learning for all",ML-For-Beginners,github.com/microsoft/ML-For-Beginners,42522,"python,education,data-science,machine-learning,r,scikit-learn,machine-learning-algorithms,ml,machinelearning,machinelearning-python,scikit-learn-python","Oct 11, 2022",microsoft,github.com/microsoft
"Data science Python notebooks: Deep learning (TensorFlow, Theano, Caffe, Keras), scikit-learn, Kaggle, big data (Spark, Hadoop MapReduce, HDFS), matplotlib, pandas, NumPy, SciPy, Python essentials, AWS, and various command lines.",data-science-ipython-notebooks,github.com/donnemartin/data-science-ipython-notebooks,23944,"python,aws,data-science,machine-learning,caffe,theano,big-data,spark,deep-learning,hadoop,tensorflow,numpy,scikit-learn,keras,pandas,kaggle,scipy,matplotlib,mapreduce","Oct 12, 2022",donnemartin,github.com/donnemartin
Python Development Workflow for Humans.,pipenv,github.com/pypa/pipenv,23353,"python,packaging,virtualenv,pip,pipfile","Oct 16, 2022",pypa,github.com/pypa
Python Fire is a library for automatically generating command line interfaces (CLIs) from absolutely any Python object.,python-fire,github.com/google/python-fire,23208,"python,cli","Sep 29, 2022",google,github.com/google
"A Fast, Extensible Progress Bar for Python and CLI",tqdm,github.com/tqdm/tqdm,23115,"python,cli,console,gui,time,terminal,telegram,utilities,jupyter,progress,discord,progress-bar,parallel,keras,meter,progressbar,pandas,progressmeter,rate,closember","Oct 16, 2022",tqdm,github.com/tqdm
最良心的 Python 教程：,Python,github.com/walter201230/Python,13347,"python,python3","Nov 21, 2021",walter201230,github.com/walter201230
Your new Mentor for Data Science E-Learning.,Virgilio,github.com/virgili0/Virgilio,13344,"python,nlp,learning,data-science,machine-learning,statistics,computer-vision,study,tensorflow,guide,scikit-learn,learning-python,path,datascience,business-intelligence,guidelines,machine-vision,hacktoberfest,virgilio,studypath","Jul 25, 2022",virgili0,github.com/virgili0
Playground and cheatsheet for learning Python. Collection of Python scripts that are split by topics and contain code examples with explanations.,learn-python,github.com/trekhleb/learn-python,13317,"python,programming-language,learning,learning-python,python3,learning-by-doing","Oct 14, 2022",trekhleb,github.com/trekhleb
A Django content management system focused on flexibility and user experience,wagtail,github.com/wagtail/wagtail,13281,"python,cms,django,wagtail,hacktoberfest","Oct 17, 2022",wagtail,github.com/wagtail
Project documentation with Markdown.,mkdocs,github.com/mkdocs/mkdocs,15112,"python,markdown,static-site-generator,documentation,mkdocs","Oct 16, 2022",mkdocs,github.com/mkdocs
"An efficient, small mobile key-value storage framework developed by WeChat. Works on Android, iOS, macOS, Windows, and POSIX.",MMKV,github.com/Tencent/MMKV,15088,"android,kotlin,python,windows,macos,swift,golang,ios,key-value,wechat,flutter","Sep 29, 2022",Tencent,github.com/Tencent
Tool for producing high quality forecasts for time series data that has multiple seasonality with linear or non-linear growth.,prophet,github.com/facebook/prophet,15015,"python,r,forecasting","Sep 21, 2022",facebook,github.com/facebook
Faker is a Python package that generates fake data for you.,faker,github.com/joke2k/faker,14856,"python,testing,fake,dataset,test-data,fake-data,test-data-generator","Oct 15, 2022",joke2k,github.com/joke2k
Instagram Bot - Tool for automated Instagram interactions,InstaPy,github.com/InstaPy/InstaPy,14698,"python,bot,instagram,automation,script,selenium,clarifai","Aug 25, 2022",InstaPy,github.com/InstaPy
Scalable user load testing tool written in Python,locust,github.com/locustio/locust,19930,"python,http,benchmarking,load-testing,locust,load-generator,performance-testing","Oct 17, 2022",locustio,github.com/locustio
TensorFlow Tutorial and Examples for Beginners (support TF v1 & v2),TensorFlow-Examples,github.com/aymericdamien/TensorFlow-Examples,42297,"python,machine-learning,tutorial,deep-learning,examples,tensorflow","Aug 30, 2022",aymericdamien,github.com/aymericdamien
Rich is a Python library for rich text and beautiful formatting in the terminal.,rich,github.com/Textualize/rich,40231,"python,emoji,syntax-highlighting,markdown,terminal,progress-bar,python-library,python3,traceback,ansi-colors,rich,tables,terminal-color,progress-bar-python,tracebacks-rich","Oct 17, 2022",Textualize,github.com/Textualize
"Iconic font aggregator, collection, & patcher. 3,600+ icons, 50+ patched fonts: Hack, Source Code Pro, more. Glyph collections: Font Awesome, Material Design Icons, Octicons, & more",nerd-fonts,github.com/ryanoasis/nerd-fonts,38860,"python,octicons,shell,font,fonts,patcher,font-awesome,icon-font,powerline,statusline,iconic-fonts,patched-fonts","Oct 14, 2022",ryanoasis,github.com/ryanoasis
100 Days of ML Coding,100-Days-Of-ML-Code,github.com/Avik-Jain/100-Days-Of-ML-Code,38628,"python,machine-learning,tutorial,deep-learning,svm,linear-regression,scikit-learn,linear-algebra,machine-learning-algorithms,naive-bayes-classifier,logistic-regression,implementation,support-vector-machines,100-days-of-code-log,100daysofcode,infographics,siraj-raval,siraj-raval-challenge","Jul 25, 2022",Avik-Jain,github.com/Avik-Jain
The fastai deep learning library,fastai,github.com/fastai/fastai,22878,"python,machine-learning,deep-learning,gpu,pytorch,colab,notebooks,fastai","Oct 17, 2022",fastai,github.com/fastai
Ray is a unified framework for scaling AI and Python applications. Ray consists of a core distributed runtime and a toolkit of libraries (Ray AIR) for accelerating ML workloads.,ray,github.com/ray-project/ray,22342,"python,java,data-science,machine-learning,reinforcement-learning,deep-learning,deployment,tensorflow,optimization,parallel,pytorch,distributed,model-selection,hyperparameter-optimization,ray,automl,hyperparameter-search,serving,rllib","Oct 17, 2022",ray-project,github.com/ray-project
Python packaging and dependency management made easy,poetry,github.com/python-poetry/poetry,22254,"python,package-manager,dependency-manager,packaging,poetry","Oct 16, 2022",python-poetry,github.com/python-poetry
"Make Your Company Data Driven. Connect to any data source, easily visualize, dashboard and share your data.",redash,github.com/getredash/redash,21911,"visualization,javascript,mysql,python,bigquery,bi,spark,dashboard,athena,analytics,postgresql,business-intelligence,redash,redshift,databricks,hacktoberfest,spark-sql","Oct 14, 2022",getredash,github.com/getredash
