about,projname,projurl,star,topics,update,username,userurl
Free (as in freedom) open source clone of the Age of Empires II engine,openage,github.com/SFTtech/openage,11282,"game,python,linux,c-plus-plus,qt,cmake,opengl,clone,game-engine,cpp,multiplayer,engine,game-development,entity-component-system,nyan,cpp17,openage,age-of-empires,rts-engine","Oct 17, 2022",SFTtech,github.com/SFTtech
The premiere source of truth powering network automation. Open source under Apache 2. Public demo:,netbox,github.com/netbox-community/netbox,11277,"python,network,sysadmin,infrastructure-management,network-automation,netbox,ipam,dcim,cabling,sot","Oct 16, 2022",netbox-community,github.com/netbox-community
List of Data Science Cheatsheets to rule the world,ds-cheatsheets,github.com/FavioVazquez/ds-cheatsheets,11268,"python,r,programming,spark,jupyter,datascience,cheatsheet","Jun 9, 2022",FavioVazquez,github.com/FavioVazquez
Leon is your open-source personal assistant.,leon,github.com/leon-ai/leon,11255,"nodejs,python,bot,text-to-speech,automation,privacy,ai,offline,chatbot,artificial-intelligence,speech-synthesis,assistant,speech-recognition,personal-assistant,speech-to-text,leon,flite,voice-assistant,virtual-assistant,deepspeech","Oct 16, 2022",leon-ai,github.com/leon-ai
"An open-source NLP research library, built on PyTorch.",allennlp,github.com/allenai/allennlp,11236,"python,nlp,data-science,natural-language-processing,deep-learning,pytorch","Oct 12, 2022",allenai,github.com/allenai
"HTTP Request & Response Service, written in Python + Flask.",httpbin,github.com/postmanlabs/httpbin,11202,"python,testing,api,http,json,service,http-server,httpbin","Sep 26, 2022",postmanlabs,github.com/postmanlabs
music library manager and MusicBrainz tagger,beets,github.com/beetbox/beets,11188,"python,music,cli,music-library,musicbrainz,hacktoberfest","Oct 17, 2022",beetbox,github.com/beetbox
"12 Weeks, 24 Lessons, IoT for All!",IoT-For-Beginners,github.com/microsoft/IoT-For-Beginners,11176,"python,raspberry-pi,iot,rpi,microcontroller,cpp,hacktoberfest,iot-device,iot-edge","Oct 14, 2022",microsoft,github.com/microsoft
Static site generator that supports Markdown and reST syntax. Powered by Python.,pelican,github.com/getpelican/pelican,11175,"python,static-site-generator,pelican","Sep 23, 2022",getpelican,github.com/getpelican
The Rogue Access Point Framework,wifiphisher,github.com/wifiphisher/wifiphisher,11171,"python,security,attack,malware,phishing,wifi,rogue,wifiphisher,access-point,redteaming","Aug 25, 2022",wifiphisher,github.com/wifiphisher
NLTK Source,nltk,github.com/nltk/nltk,11133,"python,nlp,machine-learning,natural-language-processing,nltk","Oct 12, 2022",nltk,github.com/nltk
Fast image augmentation library and an easy-to-use wrapper around other libraries. Documentation:,albumentations,github.com/albumentations-team/albumentations,10985,"python,machine-learning,deep-learning,detection,image-processing,image-classification,segmentation,object-detection,image-segmentation,image-augmentation,augmentation,fast-augmentations","Oct 17, 2022",albumentations-team,github.com/albumentations-team
Turi Create simplifies the development of custom machine learning models.,turicreate,github.com/apple/turicreate,10828,"python,machine-learning,deep-learning","Nov 29, 2021",apple,github.com/apple
"Automatically decrypt encryptions without knowing the key or cipher, decode encodings, and crack hashes",Ciphey,github.com/Ciphey/Ciphey,10805,"python,natural-language-processing,cryptography,cipher,cpp,hacking,artificial-intelligence,pentesting,ctf,hashes,encodings,decryption,hacktoberfest,ctf-tools,encryptions,deep-neural-network,cyberchef-magic","Oct 1, 2022",Ciphey,github.com/Ciphey
PRML algorithms implemented in Python,PRML,github.com/ctgk/PRML,10730,"python,jupyter,notebook,prml","May 14, 2022",ctgk,github.com/ctgk
"Launched in 2018. It's 2022 and PySimpleGUI is actively developed & supported. Create complex windows simply. Supports tkinter, Qt, WxPython, Remi (in browser). Create GUI applications trivially with a full set of widgets. Multi-Window applications are also simple. 3.4 to 3.11 supported. 325+ Demo programs & Cookbook for rapid start. Extensive documentation.  Examples for Machine Learning(OpenCV Integration,  Chatterbot), Rainmeter-like Desktop Widgets, Matplotlib + Pyplot integration, add GUI to command line scripts, PDF & Image Viewer. For both beginning and advanced programmers. docs -  PySimpleGUI.org GitHub - PySimpleGUI.com. The Minecraft of GUIs - simple to complex... does them all.",PySimpleGUI,github.com/PySimpleGUI/PySimpleGUI,10696,"python,gui,qt,games,tkinter,remi,user-interface,gui-framework,pyside2,wxpython,qt-gui,beginner-friendly,systemtray,datavisualization,tkinter-gui,python-gui,tkinter-python,gui-programming,pysimplegui,gui-window","Oct 16, 2022",PySimpleGUI,github.com/PySimpleGUI
Postgres CLI with autocompletion and syntax highlighting,pgcli,github.com/dbcli/pgcli,10683,"python,postgres,database,postgresql,psql","Oct 13, 2022",dbcli,github.com/dbcli
